ranking_funerario;empresa_raw;peer_id;primas_funerario_miles_bs;primas_total_personas_miles_bs;pagina_pdf;year;archivo_fuente
1;Mercantil C.A., Seguros;mercantil;246210.07388;8677459.76666;;2024;seguro-cifras-2024-descargables.xlsx
2;Mundial, C.A. de Seguros;mundial c a de seguros;104032.43765;115790.51918;;2024;seguro-cifras-2024-descargables.xlsx
3;Fe C.A., Seguros;fe c a seguros;88993.54968;100434.7343;;2024;seguro-cifras-2024-descargables.xlsx
4;Banesco Seguros C.A.;banesco;63166.57031;722363.6746599999;;2024;seguro-cifras-2024-descargables.xlsx
5;BBVA Seguros, C.A.;bbva seguros c a;61553.09634;98962.54422;;2024;seguro-cifras-2024-descargables.xlsx
6;Mapfre La Seguridad, C.A. de Seguros;mapfre;34128.53936;1255041.61873;;2024;seguro-cifras-2024-descargables.xlsx
7;Universitas, C.A. Seguros;universitas c a seguros;24020.74413;584259.48023;;2024;seguro-cifras-2024-descargables.xlsx
8;Internacional, C.A. de Seguros;La Internacional;21899.01516;1884632.9712299998;;2024;seguro-cifras-2024-descargables.xlsx
9;Horizonte, S.A. Seguros;horizonte s a seguros;18770.55833;214661.09156;;2024;seguro-cifras-2024-descargables.xlsx
10;Pirámide C.A., Seguros;piramide;18280.48417;1109429.18665;;2024;seguro-cifras-2024-descargables.xlsx
11;Previsora, C.N.A. de Seguros;previsora c n a de seguros;17919.52457;48233.29887;;2024;seguro-cifras-2024-descargables.xlsx
12;Virgen del Valle C.A., Seguros;virgen del valle c a seguros;14313.43126;14313.43126;;2024;seguro-cifras-2024-descargables.xlsx
13;Capital C.A., Seguros;capital c a seguros;13320.04206;20917.28405;;2024;seguro-cifras-2024-descargables.xlsx
14;Oceánica de Seguros, C.A.;oceanica;12593.29647;1100275.8061600002;;2024;seguro-cifras-2024-descargables.xlsx
15;Miranda C.A., Seguros;miranda;11027.36404;255900.11073000001;;2024;seguro-cifras-2024-descargables.xlsx
16;Venezuela C.A., Seguros;venezuela c a seguros;10569.4939;558650.11239;;2024;seguro-cifras-2024-descargables.xlsx
17;Constitución C.A., Seguros;constitucion;5372.7778;2000461.01631;;2024;seguro-cifras-2024-descargables.xlsx
18;Altamira C.A., Seguros;altamira c a seguros;3388.86231;479784.21642;;2024;seguro-cifras-2024-descargables.xlsx
19;Qualitas C.A., Seguros;qualitas c a seguros;3022.73679;324024.63483999996;;2024;seguro-cifras-2024-descargables.xlsx
20;Andes C.A., Seguros;andes c a seguros;2307.79593;104086.48098;;2024;seguro-cifras-2024-descargables.xlsx
21;Nuevo Mundo S.A., Seguros;nuevo mundo s a seguros;1291.83471;18590.75312;;2024;seguro-cifras-2024-descargables.xlsx
22;Real Seguros, S.A.;real seguros;1259.73923;350274.03234;;2024;seguro-cifras-2024-descargables.xlsx
23;Proseguros, S.A.;proseguros s a;900.51947;1885.62792;;2024;seguro-cifras-2024-descargables.xlsx
24;Atrio Seguros C.A.;atrio seguros c a;891.00763;63477.13162;;2024;seguro-cifras-2024-descargables.xlsx
25;Uniseguros S.A., Aseguradora Nacional Unida;uniseguros s a aseguradora nacional ;764.25249;56838.33134;;2024;seguro-cifras-2024-descargables.xlsx
26;Hispana de Seguros, C.A.;hispana;445.62229;944353.80699;;2024;seguro-cifras-2024-descargables.xlsx
27;Caroní, S.A., Seguros;caroni s a seguros;255.1458;8314.85699;;2024;seguro-cifras-2024-descargables.xlsx
28;Zuma Seguros, C.A.;zuma seguros c a;251.3628;417.08095000000003;;2024;seguro-cifras-2024-descargables.xlsx
29;Venezolana de Seguros y Vida C.A.;venezolana de seguros y vida c a;187.59394;8806.208560000001;;2024;seguro-cifras-2024-descargables.xlsx
30;Catatumbo C.A., Seguros;catatumbo c a seguros;109.75329;1509.24531;;2024;seguro-cifras-2024-descargables.xlsx
31;Vivir Seguros C.A.;vivir seguros c a;86.97913;4319.88559;;2024;seguro-cifras-2024-descargables.xlsx
32;Universal de Seguros C.A.;universal de seguros c a;32.31258;287.45586000000003;;2024;seguro-cifras-2024-descargables.xlsx
33;Ávila C.A., de Seguros;avila c a de seguros;6.16198;471.07722;;2024;seguro-cifras-2024-descargables.xlsx
34;Adriática de Seguros, C.A.;adriatica de seguros c a;0;0;;2024;seguro-cifras-2024-descargables.xlsx
35;American International, C.A. de Seguros;american international c a de seguro;0;3019.55125;;2024;seguro-cifras-2024-descargables.xlsx
36;Bolivariana de Seguros y Reaseguros, S.A.;bolivariana de seguros y reaseguros ;0;0;;2024;seguro-cifras-2024-descargables.xlsx
37;Carabobo C.A., Seguros;carabobo c a seguros;0;0;;2024;seguro-cifras-2024-descargables.xlsx
38;Caracas C.A., Seguros;caracas;0;6662319.70417;;2024;seguro-cifras-2024-descargables.xlsx
39;Corporativos C.A., Seguros;corporativos c a seguros;0;158.43236;;2024;seguro-cifras-2024-descargables.xlsx
40;Estar Seguros, S.A.;estar seguros s a;0;528480.9957600001;;2024;seguro-cifras-2024-descargables.xlsx
41;Guayana C.A. Seguros;guayana c a seguros;0;0;;2024;seguro-cifras-2024-descargables.xlsx
42;Iberoamericana de Seguros C.A.;iberoamericana de seguros c a;0;407.63006;;2024;seguro-cifras-2024-descargables.xlsx
43;Interbank Seguros, S.A.;interbank seguros s a;0;0;;2024;seguro-cifras-2024-descargables.xlsx
44;Latitud Seguros C.A.;latitud seguros c a;0;453.50319;;2024;seguro-cifras-2024-descargables.xlsx
45;Multinacional de Seguros, C.A.;multinacional de seguros c a;0;0;;2024;seguro-cifras-2024-descargables.xlsx
46;Occidental C.A., Seguros;occidental c a seguros;0;0;;2024;seguro-cifras-2024-descargables.xlsx
47;Oriental de Seguros C.A.;oriental de seguros c a;0;0;;2024;seguro-cifras-2024-descargables.xlsx
48;Primus Seguros C.A.;primus seguros c a;0;34.23086;;2024;seguro-cifras-2024-descargables.xlsx
49;Regional C.A. Seguros;regional c a seguros;0;0;;2024;seguro-cifras-2024-descargables.xlsx
50;Vértice, C.A. Seguros;vertice c a seguros;0;22129.15117;;2024;seguro-cifras-2024-descargables.xlsx
51;Vitalicia, S.A., Seguros;vitalicia s a seguros;0;67.3575;;2024;seguro-cifras-2024-descargables.xlsx
52;Fuente: (SEFA) Estados Financieros Analíticos Anuales. Empresas de Seguros.;fuente: (sefa) estados financieros a;0;0;;2024;seguro-cifras-2024-descargables.xlsx
